<?xml version="1.0" encoding="UTF-8"?>

<!--
    Document   : strinXtest.xml
    Created on : 17. november 2011, 09:02
    Author     : james
    Description:
        Purpose of the document follows.
        A test file for the strinX framework
-->

<stringtable  xmlns:xsi='http://www.w3.org/2001/XMLSchema-instance'
   xmlns='http://www.jameshoyland.net/schema/strinX'
   xsi:schemaLocation='http://www.jameshoyland.net/schema/strinX strinx.xsd' language="en">
    <string  id="greeting">
        <text>
            Hello <arg/> !!
        </text>
        <translate language="fr">
            Bounjour <arg/> !!
        </translate>
        <translate language="da">
            Hej <arg/> !!
        </translate>
    </string>    
    <string  id="howdy">
        <text>
            How are you?
        </text>
        <translate language="fr">
            Comment ca va?
        </translate>
        <translate language="da">
            Hvordan gor det?
        </translate>
    </string>
</stringtable>
